{"scene_id":"scene.playable.raid.machine_silo","display_name":"Playable Machine Silo Raid","level_name":"machine_silo_raid","level_asset_path":"Levels/machine_silo_raid/machine_silo_raid.prefab","spawn_point_id":"spawn.raid.entry","transition_card_id":"transition.playable.machine_silo_raid","proof_room":"false"}
